username,tweet
bevintharaj, 
vin_der_pal,hit over 200k tweets hours
syedaidibb,
ayambakaq,bangkitlah rakyat rakyat sekalian dan sedarlah bahawa kerajaan kita gagal 
nama_90s,bila dah memang gagal bodoh bangsat dorang menyusahkan atm pasang bukak benda menyusahkan semua orang menyusahkan rakyat   
ayambakaq,✊✊
haziqzolkiflee,tetap 
bawani_ks,hanya satu cara 
itskemboja,selamat pagi jangan bersedih sebab korang masih lagi berguna daripada menteri malaysia yang bodoh  
cheapremebrand,seperti biasa kena hijack oleh cytro reported and algorithm buat ianya hilang mcm kena truskn kembali satu akan kekal xboleh tukar cytro semangat kita terus 
cikicomel,king coco sibuk dah sekarang dengan bersatu apa pun 
owesemboi,kerajaan claim mereka sudah buat bermacam macam dorang tidak gagal result ramai hilang pekerjaan ramai yang membunuh diri kes covid meningkat berbanding sebelum darurat kadar dan supply vaksin yang rendah 
sharirshazni,aik dan dah tak trending 
kammosiwong,mainstream media too chicken cover they are afraid raids pdrm mcmc etc its method suppress free speech remember its not seditious nor again any religion race 
farahnatt,selamat pagi 
rsyr_,morning and don’ forget your  
kammosiwong,kalau ada peluang sekarang peluang susah nak dapat hanya untuk orang kayangan kita rakyat biasa tak ade jalan tak ade duit miskin 
dickheadabu,boleh 
aliefakmal1,symbol materialize the form black flag angry citizens and their righteous anger the rise the people voices the form history repeating itself 
efanhamza,selamat pagi muhyiddin dan konco konconya tidak selamat 
arvinthesky,since dismisses the you expect everyone raise their hands and chant the name god expect the foods and supplies fall their lap life have tested people enough please behave humanely possible the next person 
sit0922,other than obesity kebodohan keangkuhan runs family 
poji63,…dedulu zaman black metal bebudak muda pakai tshirt hitam kena tahan kena momok kemudian warna kuning jadi “taboo” then belon kuning pun kalau boleh masuk lock now trending bendera hitam … tak tau laa samada buta warna atau buta hati … 
cheeseundrcover,not allowed out but guys can wth this and asking why 
dark0will,alamak takleh brain aku hahahahahah  
aldeenor,dengan kerana tidak peduli kesengsaraan rakyat 
3da_nash,this has been doing for years every time succeeded nearly succeed someone simply just swooped claim victory sincerely hope not another someone who that support openly 
frdausrazak,sebenarnya agenda untuk dapatkan shawl baru shj tuan tapi tak mengapa lawan tetap 
jawajohor2,trending kajang  214k 
kevster1268,assume incompetence before conspiracy machiavelli 
rhidaryad,mereka pacak bendera tempat kediaman mereka sendiri bendera putih bendera hitam bendera kelabu asap apa masalah kacau pandangan mata korang 
uzumakihagemaru,apa masalah nak gantung bender hitam benda memang betul kerajaan gagal sebahagian dari anggota pun ada yang gagal menjalankan tugas dengan amanah bukti bersepah kat twitter 
mulianidalhan,balances out the lost words our gov’ incompetency seriously can even more bodoh everyday 
qizbalqis,dia comment mcm because ’ posted the black flag picture lepastu tgk dia dah delete gambar sendiri 
aizuddinkhalid,keep making stupid decisions that jeopardise the live and livelihood all malaysians and because they makan durian ramai2 
burithhhhhh,rakyat mula muak fuck politik 
aikram75,assalammualaikum mohon retweet untuk kelangsungan hidup kala pkpd saya nak share penapis udara coway ada promo sekarang klik coway mall link ini terus order penapis udara coway anda 
penasuria,white flag pun dipoliticise nak save face sanggup tak kasi sbb kami penat dgn sekian saya akan teruskan kerana saya inginkan masa hadapan yang cerah untuk rakyat ’ government gonna save 
lavs_unfiltered,you’ student malaysia and you choose remain apolitical— congratulations you’ just screwed yourself this incompetent govt stole our youth education for months and counting while not alleviating the struggle having pay our fees full 
fahimazzam,fuyo waking timeline semua bendera hitam 
hewoijah,selain ahli politik yang tak boleh join angkat ️ dan angkat  tanda ada satu golongan tak boleh join golongan yang salahkan rakyat satu ketika dahulu kecuali mereka yang insaf yeah come join 
penasuria,kerana ahli ahli politik yang tidak berperikemanusiaan yang tidak mendahului rakyat dan menggunakan agama islam sebagai alat politik sistem yang tidak transparent lagi lagi program vaksin yang lambat dan tidak cukup effektif 
drsyarizan,apa lah lagi rancang nak buat rancangan jijik lagi utk terus berkuasa ehh babi korg dah tua lah babi bila bila masa mampus baik kau taubat dah2 lah mkn duit haram bangsat parlimen tkut pula nak msuk bodoh 
badboy2662,bayangkan uel pernah kena block masuk kawasan kerana ada pihak atasan sakit hati this why kita kena 
abdialhaadi,let’ gooooo onigashima 
niwasini_k,know ’ not easy trusted you for more than year but what’ the result 5434 people died due the infection not counting those who lost their life struggling survive this pandemic end the emergency proclamation and open the parliament 
sarfabian,good morning starting new dawn and 
lanchiaop,ganti kerajaan ada apa guna kalau ketuanan melayu dikekalkan same tea different pot you will still suffer from mismanagement dun believe wait and see 
hziqfkr,guna muka sendiri nak boleh aku pon dah cukup hitam dah belum lagi hati aku hahahahaahaaha
lanchiaop,kerajaan ketuanan melayu check and balances multi racial society naik bendera warna apa pun tak guna you deserve the govt you voted for 
l1li_nya,its time take back our country  
lanchiaop,kerajaan sekarang adalah hasil ketuanan melayu semua kena dikuasai melayu konon result majority mati dan suffering are melayu happy now 
amatselamat,balik kampung dan start tulis buku back diri sendiri cetak kulit tebal tau kuikui 
hazgus,sendiri bagi arahan pasang sendiri nak jadi hero arahkan buka 
farisaizat,you don necessarily need atomic bombs destroy nation politicians who value their pockets than the life citizens always that every day maybe 
hazgus,sangkakan israel rupanya 
sotong_terbang2,perghhhh mcm kena balik dia zalimi rakyat allah balas dgn aib and pekung dia terbukak mcm peringatan utk lebai2 kat luar sana jgn jadi penunggang agama 
mankimcat,good morning daily reminder selagi turun selagi lah aku spam this isn one day fight this our generation war 
sadsaddieissad,tired the manipulation from govt people are suffering children couldn enjoy their childhood suicide cases are rising people are burnt out cases aren dropped hospitals are full and frontliners are exhausted 
thekishenthinks,article the constitution malaysia guarantees right freedom speech and expressions unless restriction imposed the federal law hence manifests that are clearly exercising our rights legally all means why wait let for  
asyrafunk,jangan pernah mengalah guys 
amirulzickery,has mysteriously disappeared from the trending list malaysia 
maximillianleen,sebab double standard kerajaan pening dengan sop yang sentiasa berubah penat dengan pengurusan pandemik yang tak efficent kerana rakyat biasa hidup merana sedangkan menteri hidup mewah  
badboy2662,kita kena buka mamak before semi finals coz aku dah lemau tgk bola sorg2 kat rumah need happy again guys  
badboy2662,✊
naaahnie,good morning 
jeeahmad,rakyat tak boleh bersosial wpn dalam rumah sendiri korang boleh pulak 
tatwaiphang,the government should afraid people especially the 
namttoki,wait why black now wasnt white 
ganxhiyan,waking the midnight just realise someone removed can removed but tanda can 
irmizwan,pkp pkpb pkpd dan segala varian pkp bukannya dpt turunkan kes covid pun hanya menambahkan kesusahan rakyat marhaen dan double standard 
mozution,when they say they want beri peluang for anak muda yelah anak muda anak dato anak tan sri anak anak ceo anak ketua bahagian anak ketua cawangan anak itu anak ini asalkan muda anak muda marhaen boleh sambung buat foodpanda grab terima kasih 
solehudinrosman,aku joint gak dah alang2 subuh 
dzarif_arifin,tribute 
yoyoshar,kalau tak boleh guna tudung bawal hitam gantung kat rumah apa lagi kita boleh buat like seriously 
adrianflude,every country suffering the effects thread  hope tale compassion act not surrender 
sauficoupy,yat rakyat dgn masa depan yang gelap bendera putih dikibar untuk cari sinar harapan bantuan orang lain sampai kat politician2 bangsat dikatanya propa semata mata 
hazwan_puzi,bendera ahh biasa aku bagi kucing hitam 
badrimarcello1,bendera hitam not just flag beginning movement fighting for the rakyat claimback malaysia doing small part this solidarity tired tired with this gov 
azwanrizani,netizen dah buat kerja mampus kau nak menjawab nak putar apa lagi kat dunia boleh kona sana sini kat akhirat nanti lagi jenuh kau nak menjawab dasar sialan 
wafiealaziz,          
8urn88q,kelakarlah nih dulu takut warna kuning belon kuning baju dlm kuning alphard kuning smua kuning  skrg warna  velfire hitam membalak tak takut pulak  
ammaraffandi96,fuck off the new world order❌ need the new revolution freedom the future 
raihanmahadi,maaf tertinggal train aku pun dah penat dgn pak menteri ber huhu haha 
zhenyang_low,got goosebumps seeing this 
grieffinn,smol perlis anyway fuck the government 
joonbabe47,joon has better leadership compared all the malaysian ministers 
mozution,wear black everyday since 2017 does that mean part 
diskusiborneo,why need fight ensure vacination program that being spend huge public fund being more effective especially around sarawak sabah diskusi borneo team also glad support fast vacination program among other state malaysia 
sachwir,only nayak bolly movie was doable 
ariffateed1,lawa tetap lawan 
_ibro_my_,black flag rises 
penerangrakyat,pinjam kalam pembangkang ini lahir jalanraya tak takut kena pukul sembur tahan seksa kalau bergaduh hatta bertumbuk pun itu biasa jgn sekali kali tuduh mereka takut turun jalanan demo tok kenal barey boh 
mimiuwww,nak angkut berapa ramai orang polis careful 
tiaraau54619491,kelakar tak buat kerja sop pkpd lebih ketat drpd total lockdown fmco spp 
mackillah,black flag war  
diskusiborneo,wonder join all twitterian fight this uneffective government disclaimer art work not produce diskusi borneo team 
annieveeee,hadir  
_rodahidup,siapa saya jalan keluar hanyalah vaksin bukan political murahan mane janji 
ayiefrz,saya kerana kerajaan yang tidak telus dan gagal dalam menangani kenaikan kes covid malaysia double standard pendidikan kebajikan pelajar‐pelajar malaysia jawatan tinggi kerajaan diberikan kepada ahli keluarga menteri yang tidak layak utk memegangnya
2ndrandomizr,and they wonder why hang sick and tired news like this because they know they can get away with and all can 
ibnujang,setiap tahun tukar kerajaan kerajaan buat hal kita maki pembangkang naik jadi kerajaan kalau sama bangang kita tukar lagi tukar sampai abg jamil mampus biar orang politik yang tinggal hanya yang ingin bekerja untuk rakyat bukannya menghabiskan duit rakyat demi keturunan 
yahallufarah,mereka mereka mungkin bercanggah dengan aku tapi aku rasa sedikit shaking bila baca ruangan komen post hafeez mikail untuk  
ibnujang,kita perlu normalised kan tukar kerajaan biar ahli politik tau kedudukan mereka takkan selamat kalau tak memang kena kencing bhai muhyiddin anjing pegang kejap pun dah hancing dah 
yoursy4f,pergi kedai membeli cincau korang sambungla 
jhun_kheng,younger generation not wanna see country land called home suffer dont wanna see fellow malaysians starve die many life has been taken already and cant lose more enough enough 
salehudin_sdb,quote july 
haziqikhsan,saya ingin lihat semua ini berakhir pramoedya ananta toer 
xunlingau,that was fast nice one 
abience00,agak agak apa lah pdf muhyidin esok kan 
_omgitsjack,38am and extremely  and also biggest fuck you our beloved 
mta_museum,stands with malaysia  our cover tweet for while —— follow support 
kamalsuriaa,preach 
akyukoz,but still the government chose deaf and blind speak about nothing but secure their positions corrupting every cent they can lay their hands power abuse securing capitalists double standard munafik stealing and undeniably killing people 
mackillah,black flag nothing left inside 
larasatifputri,lagu tema 
yuvanraj_27,for those who need for pets for kerajaaan gagal 
onerockfather_,kau buang lah dengan bendera hitam kau 
syafiqarif3yung,get well soon malaysia  are you seeing this you dumb ass shit 
an_afdhal,was here 
hidayahsamdin,apparently ’ late but who said ’ gonna stop ’ just start
ismerahh,baru naik black flag dah goyang choiiiii nyah kahkah 
zul_arief,muak dan mual 
mhffz_,kesian orang malaysia selain kena covid19 kita jugak kena lawan politikus bodoh dan kemunculan agamawan jadian 
yanameera,mohon izin guna gambar 
blvckbvnny,serious penat nak jawab banyak sangat sebab kami 
omni0ne,sketch character from conan exiles waving 
wafiealaziz,         
_mirahman,bit late but here 
natasyakass,maleh nak ulas issue politic kat acc public just tweet about secara gila babi kat private account issue sangat sensitive malas nak jumpa orang orang yang bitter tapi apa apa pun kita 
endabyu_,steady  aci come 
nshfnoh,spreading this thread need strategic measures haven’ they learnt the past year have covid 
bbbbppp_,malaysia needs change 
wafiealaziz,                 
rafhantsui,lawan  
mad_mt,salam tuan saya harap pihat tuan boleh siasat kes dulu sebelum siasat kempen rakyat untuk makluman tuan saya menaip tweet ini sambil tangan kiri saya mengibar bendera hitam 
razinasyraf3,semoga tak semuanya selalu gelap  
isjwbckh,pls people are sick you just resign
ohjenal,kempen bendera hitam takde kacau orang awam tak langgar sop covid tak buat perhimpunan lagikan rusuhan but kenapa nak siasat kempen takde gugat mana mana pihak pun kecuali kerajaan yang gagal 
niaga24jam,ramai lagi yang perlu disedarkan 
wafiealaziz,              
8urn88q,come wit now  credit ratm bullsonparade rindu gig2 zaman nih 
diane_dcruz13,don try silence will only get louder
niaga24jam,maknanya masej telah sampai pasti menang 
annieveeee,jeng jeng jeng 
syfiqzck_,aku punya story ada kena remove hahahaha mula mula kena shadow banned lepastu hilang terus 
faridahfaiz,standing solidarity with the movement today when injustice becomes law resistance becomes duty 
fauzanfthllh,come guysss tidak goyang tak pernah goyang 
animefolyf,what the criteria malaysia google has few answers raging question but not satisfying there age limit education that she must achieve before being appointed the agong really need know this 
nooraminahmad,kita bukan kerana kita kuat tapi kerana kita sedar elemen sedar dalam masyarakat itulah mana mana dalam sejarah menjadi pendorong kemerdekaan mereka tidak selalu menang bahkan mungkin terbuang kerana bukan menang jadi persoalan tapi maruah diri jadi taruhan 
annieveeee,last detected hashtag trending page what’ mind 
zamhariz18,malaysia minorities ethnic religion sexual orientation long suffered under conservative majority new opportunity when everyone unites against injustice all deserve happiness let steadfast ensure 
aidilsfwn,scraped tweets from the reply section tweet and generated word cloud not surprised penat the main theme 
corsaeldiablo,arent not pkp the one yang sepatutnya total lockdown macam pastu dia bole pulak kasi kilang bukak pastu tah celah mana tetiba pkpd pkpp pkp apa nampak gagal kat situ 
wafiealaziz,hancurkan kebuluran pencabulan hak asasi manusia hancurkan ketidakadilan jurang miskin kaya yang semakin mendadak hancurkan kezaliman salah guna kuasa pemerintah dan undang undang 
annieveeee,hilang from trending guess kita kena tumpang hashtag kot hehehehehehehehehe 
berttyih,fight survive fight heard fight have better country fight have better governance fight live another day
raxnsy,rasa dianiaya kerajaan tak pernah ambil kisah tentang rakyat untuk selamatkan masa depan saya sendiri kita perlukan pemimpin yang bijak muda bertenaga dan tak menipu rakyat 
mirulha90,sorry sounds ridiculous 
shrhanum_,longer trending huh 
wafiealaziz,yang kamu sepatutnya kena takut adalah politikus fasis aparat bangsat penyembelih rakyat yang zalim bukannya gerakan kuasa rakyat 
raxnsy,saya  its time change the corrupted government into new younger stronger intelligent candidate 
serrafearless,muhyiddin needs step down asap only then there will glimpse hope for malaysian 
wafiealaziz,apa kamu takut sangat dengan anti fasis tetap lawan 
zamhariz18,minoriti malaysia sama ada kaum agama atau orientasi seksual sudah lama derita ditindas majoriti konservatif buka peluang baharu pabila rakyat bersama kezaliman moga istiqamah perjuangkan kita semua berhak bahagia 
wafiealaziz,                  
nafsiahmahmud,when injustice becomes law resistance becomes duty fight for our rights because they never fight for 
sparkfinders2,apa salahnya… dia kan dapat ‘tanah’ baru… bukanke dia nak bercucuk tanam jugak 
calistalieya,kenapa hilang dari trending 
annieveeee,fun fact the longest trend twitter   
thekampungirl,23am 2021 masih trending dan bukti betapa rakyat dah menyampah dgn semua 
shiafiku,kau dengan kerajaan kenapa ketua opposition tak boleh nak angkat bendera did nothing hijacked 
calistalieya,sape kata kita kena turun kat jalan please dalam kereta guys kalau korang nak buat pun tak perlu trun jalan kita jgn jadi bebal macam menteri kesian frontliner kita semua burnout dah our aim untuk turunkan kes penat day lockdown bertahun 
blingb1ink,apa jadi dgn malaysia haih risau tgok kedai bukak mcm mana dorng hidup dgn duit tkde kita pulak pkp bagai rak tpi kes turun turun  
wafiealaziz,     
hazrinhafetz,steady bang keep respek abg lawan tanpa mengharap apa2 dari parti itu
annieveeee,sorry terlewat minit pasal mkn jap kalo hit 200k time hehehehehehe   
salemthecats,momentum kebencian dah ada cuma nak tunggu ade satu watak yang bawak panji bendera hitam dan ber arak keliling kota kuala lumpur 
lann_aziz,boleh kalau semua mau 
hazwanhfiz,jika kritikan dilarang tanpa alasan maka hanya ada satu cara solidariti bersama  
sparkfinders2,hello pulis sini ada orang berkumpul… 
kisheyem,wow you care much arahan untuk buka parlimen serta boleh harap maklum 
sparkfinders2,mana dia kpn yang sembang kata ‘ one above the law ’ sembang kari 
sparkfinders2,kdn ‘budak’ kita daa… 
aqilizham288,hahahahhaa
annieveeee,’ here along with everybody else ’ sunday and ’ new day sape tito tito dulu nunyte sleep tight   
yanameera,mohon izin guna 
lionfromtheeast,malaysia may the force with you malaysia 
ridhwanshahz,luahan rakyat sampai terpaksa buat thread 
colinjoshuaa,your bold voice now determines the future  
yanameera,trending 208k tweets kita biarkan ianya trending beberapa hari lagi  
princejoe5678,patut lah rakyat kena kibar bendera putih ️ bendera hitam tengah susah nak dapatkan bantuan pun susah jugak… 
mcqisti,kerajaan literally ing opportunity for education transcript smue xkluar sbb office tutup missed few college application deadlines sbb xde official transcript 
ridhwanshahz,tak tahan dengan pkpd yang dilaksanakan selangor wal hal kebanyakan penduduk selangor hanya stay home tetapi masih lagi kes meningkat dan tidak menurun selama sebulan malah kluster tempat kerja dan kebanyakannya industri masih lagi dibuka 
jr_crunk7,tetap kroni politikus sebgini perlu dihapuskan cukuplah menganiayakan negara kita yang tercinta warga muda jangan buta dengan propaganda perkauman yang kroni kroni selalu memetik bila sampai pru nanti jangan lupa 
annieveeee,like the subtleness the houses deco look closer  gorgeous   
yul_z,contribution may blessed and protected 
keluhanetizen,muhyiddin mahiaddin mahyuddin whatever your name just get out and get lost 
apapbinzamri,rakyat masih menderita politikus tidak pernah peduli 
megatfirdauz,jahanam why have keep punishing those need again again mps belittling the bendera putih movement and won’ even help those who wave the flag saying ’ propaganda and all apa dosa diorang 
hazrinhafetz,pastu ckp taksub pemimpin taksub parti diri sendiri takde sumbangan apa2 setakat dua ibu jari sahaja
lionfromtheeast,home country this fight against the tyrannical and undemocratic government who robbed our rights ✊ 
ryzalazwir,bila segelintir pemimpin gila kuasa dan berkepentingan pemimpin sekarang dan juga sebelumnya tiada beza ada yang poyo amik kisah tapi hanya boneka ada yang perihatin tapi hanya sandiwara moga tuhan laknat semua yang menindas 
ajamiha,kalau ditegur guruh berdentum langit tanda ribut bakal runtuh sebentar lagi haruskah aku berdiam melihat jemuran hanya mengharap kain berlipat sendiri nanti basah tanpa seurat benang telanjang hanya tinggal seorang ajami 04072021
annieveeee,gang lesgo   
asghaff,rakyat pacak tiang bendera dia pacak tiang kote 
annieveeee,art sings  thanks ☺️  
siraxchurros,kibar sini pun rasa boleh dah 
hazrinhafetz,the original setakat aku kau kita2 sembang dalam twitter the comfort our bed xyah ckp opportunis org keluar masuk penjara dari zaman universiti lagi kita mkn minum kadang2 mak bagi duit toksah sembang setakat dlm twitter
asilhome,itu setiakawan itu kita 
reshanast, time guys 
zarulzimm,lupa pulak dekat username boleh pacak 
fruityfrzz,main lagi politik sila2 
ly_tripleh,dekat² setahun lebih tak dengar rapatkan saf makin hari perangai macam yahudi tak sangka ayah pin rupanya muhyiddin  cepat² lah 
syfhz75,gather kat parlimen tak boleh gather kat rumah boleh pulak gila punya failed kerajaan skrg siap polis cover line lagi 
qissywoopsy,dah lah aku sambung belajar takda ambik apa apa pinjaman semua fully bapak aku bayar pastu yuran kolej takda kurang macam cilaka duit buku lagi bagai bodoh  done luahkan
ilyasyafiq,user 206000 3500000 100 active 206000 762000 100 based 2014 data from google itu benar 
jeffreychiang66,this plan for covid need way better 
farahnatt,kat ramai otak sempit and kaitkan dekat politik  
mas_merah65,untuk malaysia tanah tumpah darahku 
suelaosman,ayuhhhh 
qissywoopsy,aku  walaupun aku benci bapak aku aku tahu dia tengah susah gaji tak jalan sekarang bukan saja saja nak maki bangsat bangsat bapak aku ada aku dengan adik adik aku bini dia nak kena tanggung lagi macam macam moklu sapa ritu cakap yang nak sebok berjimba
rubymas2,rakyat masih menderita politikus masih tidak peduli 
weelz72614499,hope are getting somewhere goodnight rakyat should not end here 
1stnewsng,president urges lawmakers ensure implementation 
hopefulmsian,demi kita kibar demi negara kita 
kucingsiber,sementara nak tunggu tahukah anda bahawa penduduk juga sudah muak dengan lockdown tak berpenghujung dan melakukan tunjuk perasaan bezanya mereka sudah divaksin malaysia 
nohirfanfit3,kita lawan guys dah lama sangat basah kepala kene kencing 
hamba_syukur,kita semua ada syaitan yang untuk dilawan 
samshamsulazhar,hampir setiap minggu aku terima berita kematian keramat angkara covid 
imranraszali,the demands the online black flag protest happening 03jul2021 3pm the protest has three demands namely for prime minister resign immediately for parliament convene immediately and for the state emergency end 
annieveeee,the power anger arggghhhhhhhhh   
_eksponen,angkuh bangang 
adhamiroo,demi masa depan dan pendidikan anak anak demi negara yang bebas korupsi dan nepotisme demi keadilan kepada seluruh rakyat demi perpaduan kaum yang lebih utuh sehingga tidak lagi boleh dijadikn modal politik demi malaysia  kami 
binhonglee,wait till they find out about 
amirashrafjalal,paling risau suicidal case increasing teruk that can crucial indicator how that need through 
radin_suwardi,tetap selagi kita mesti 
weelz72614499,keep trending 
khairul_hizwan,hmm 
jaykayenn,our legal cultural and institutional framework allowed this nightmare happen there nothing stopping the next 000 governments from doing the same worse 
amalifaa,raise pahang flag are they still going charge under sedition act black and white they can deny our rights 
weelz72614499,this  register vote you haven’ 
mfmjzf,wah serba hitam kita 
arfzdnn,nah artwork 
weelz72614499,keeping trending please don’ mind the rts 
afiqazni,pencetus utk dtg dari perbuatan kamu sendiri taksub dgn berkeras utk tun meneruskan pentadbiran sekaligus mengkhianati persetujuan dimaterai oleh pkr dap amanah ppbm gerakan azmin zuraida semakin berani dan tercetusnya langkah sheraton 
mommymiaica,tiba masanya kami berdiri berdiri mengejutkan kalian dari tidur yang terlalu selesa dari rakyat kalian datang dari rakyat juga kalian akan pergi bermimpilah dengan bunga kerana duri akan muncul bila jaga 
madriabdullah,just the and evaporated from the trending list sigh 
irfankassim0303,why lawan when have the government showed that they are working ever since took over when have they ever told the truth the rakyat when this bullshit going end answer never have more malaysian jokers pls the government
ijatbobbie,kan nak lawan tapi tak payah join geng politaik dah jadi bodoh bila join puak2 masa jadi kerajaan pun gagal jugak 
annieveeee,that challenge hehehehehehehehehehehehehehehehehehehehehehehe 
boihachiko,“kalau kenal apa kau mahu pasti tidak haru kalau tahu apa kami mahu pasti tidak biru sekarang semua berganding bahu ingin menjatuhkan kamu kamu sedar atau kamu batu mungkin skrg kamu ketawa biar kami berduka esok kamu berduka kami ketawa” 
purrfessionals,remember this the people you trying step everyone you depend the people who your laundry cook clean your toilet pay the tax are the rakyat control every part your life don fuck with 
itsmeazriq,negara kita sedang sakit rakyat makin hari makin hilang hutan gondol tanah hilang dari bukit yang berkuasa atas rakit rakyat tenggelam disorak girang dia yang diberi kuasa dan wang rakyat ditinggalnya dalam terang tinggal kita lawan sehingga kita pula yang menang 
annieveeee,the kitties are back 
