username,tweet
nufhanaa,our lives begin end the day become silent about things that matter have the right defend our rights 
almasz_zeneca,sepoi bahasa here but still  
fx_advanc,that tudung yeay  
donanduin,dark time for our country  
matsz,malaysia current must resign current government failed 
ndnsk,mahiaddin letak jawatan parlimen dibuka segera tamat darurat 
faramyun,hari ini kita 
skintymia,aku harap kerajaan terkencing tengok semangat rakyat 
sifu_k,cuaca baik hari ini kita sidai baju 
theozsman,all black 
_amiraaisya,rise rise and rise again until lambs become lions ✊✊✊ bangsa ini bangsa melawan 
justmebala,you can’ decent job the decent thing and step down  
jurnalkolektif,julai 2021 petang tuntutan perdana menteri muhyiddin letak jawatan parlimen bersidang tamatkan perisytiharan darurat 
mdzulaiman,takpernah orang maki umno sejijik kerajaan sekarang dulu korang kem lawan umno najib sekarang rakyat lagi benci dan jijik dgn kerajaan 
boeing747s8,tak semenggah tapi bolehlah 
aaishachan,she was born for kita  
jackalasian,aint flag but its black still carries message‼️ 
marsarsi,’ fucking tired feeling this way can’ sit home and just quiet anymore  
zaki_yamani_,food bank petronas seksyen shah alam 
weathernews_my,ini satu permulaan untuk kami selagi tak dengar suara rakyat kami akan terus melawan tyranny 
berbulumakhluk,aku gunakan baju aku sendiri sebagai bendera hitam bangkit kita lawan bersama 
luq_tarmizi,don’ fight can’ win fight fight eren jaegar tak lawan tak menang 
zuyyinhanafi, jangan kena tahi burung sudah baju kakak aku 
sijasad,demi hidup yang lebih baik kita kibarkan  
ephemeralegal,you have right speak this war bukan tahap ajak gaduh style sekolah geng bagai perjuangkan hak kau sebagai rakyat malaysia sampai bila nak kena angguk dan akur dengan semua keluar dari mulut dieorg 
frizzyfazh,siapa yang start guna bendera hitam tanda untuk lawan just wanna say thank you much 
apiz_141,let fucking fight 
nuramirah_s,’ scared this but more scared future and country  
elfucir,harini kita  
madnoh,rare see when the trending topic malaysia isn’ pop related 
wan_kori,waktu untuk rakyat sama sama kebodohan dan kezaliman
nfornap,penat hari hari ada kebodohan baru 
joondaehwan,eventhough shit still better than nothing 
illspng,sampai mampus 
sesudatsesudut,bendera takdak langsir ada jadilah 
mcken7ie,hidup hidup hidup rakyat 
ijaredsyam, kerajaan bullshit  
butachickenwang,will not watch people die and stay silent will defend for our lives will not watch injustice happening and look the other way will defend for our rights 
muda_kedah,kerajaan gagal kerajaan gagal kerajaan gagal kerajaan gagal kerajaan gagal kerajaan gagal kerajaan gagal kerajaan gagal kerajaan gagal kerajaan gagal kerajaan gagal kerajaan gagal kerajaan gagal kerajaan gagal kerajaan gagal kerajaan gagal kerajaan gagal 
rksangaran,kerajaan gagal letak jawatan sekarang jugakkkkk 
aidathecat,salam semua kita lawan takde tali untuk ikat jadi tumpang dekat tempat gantung baju 
kiryuukuzuryu,tiada bendera hitam gantung baju hitam pun kira jadi 
thezubair_m,lately not interested read politics although its part field but looking b40 neigbourhood and m40 friends who suffered lot this system totally bastard keep 
__nrsffnsr__,mantap 
mohd_kns,when was young boy father took into the city see marching band 
alifnajmiez,jangan berhenti 
hermyrahim,aku ready 
t_leeken,muhyiddin letak jawatan buka parlimen segera tamat darurat  
jahnylea,our demands resignation prime minister muhyiddin the convening parliament the ending the emergency proclamation 
cudin_103,kswp dah setahun sangkut baru² allowance plak sangkut kerajaan makin hari makin bangang kes tak turun² jugak 
bibobagginses,pun jadi janji 
tokok_my,don neutral don afraid the oppressor 
azizanslmnn,letak jawatan lah sial bukak parlimen sial tamatkan darurat sial 
sheungun,henry rollins spitting truth since the 80s jealous cowards try control they distort what say try and stop what when they can themselves are tired your abuse try stop use rise above gonna rise above 
shazrulmohdisa,sorry sorry lama sangat duk rumah 
shmokeganjar,bender hitam 
deeborajarimba,demands 3rd july 3pm resignation prime minister muhyiddin the convening parliament the ending the emergency proclamation 
quarxilon,the emco will absolutely nothing but propel the malaysian pandemic all the way into war crimes territory stop the illogical optimism and face the reality that this all just political calvinball and covid merely the superweapon 
syuhada_roazmi,hahahahahahahahahhahhaha mantappp pikaaaa 
wzainidin,are not being rude are not defying the law rakyat deserve better for the sake malaysia and malaysians future must this 
samtabatabai,shirt pun jadi 
hanisbudakbaik,don have black flag instead changed island flag acnh rakyat dah penat 
emiraimann1,timeline penuh dengan and  honestly wanna cry yall brave and strong 
saphhisham,mana bini aku sorokkan tudung hitam 
itsmeagainsara_,koyak sial jnt affected this stupid pkpd nak shopping pun kena sekat bdo 
mutttaqinn,for those who are struggling dying and had enough with this government’ bullshit 
syahredzan,kita memang tengah susah tapi bila aku tengok dekat twitter dan instagram aku dapat goosebumps are this together are legion they must listen 
dhuyuf21,paling sesuai dengan sampah 
nazznazif, time for fight 
visithra,what rebel the one who says  
yuslainiazmi,mentari court currently 
globetrttr,ada batang penyapu tkde   
hmm68416238,kalau ada gamba dari baling pekan tumpat sedak skek 
muzikhidup,jeket itam pun boleh kannn 
rozyrazit,sempat pakai baju hitam harini bendera nanti lepas kerja hakak cari 
deartomato,dah 40k tweets keep coming guys 
n_azreen,tadi hujan jadi kena sidai semula baju 
harashoey,from penang  
armanamin330,undur mahiaddin buka parlimen tamatkan darurat 
mershineter,they come for you then surely your voice threat stand one rakyat 
fahadiman93,kita kene 
stevoices,timeline now flooded with july aest demands • resign • reconvene the parliament • end emergency order malaysians have had enough with lockdowns and incompetencies won’ surprise see this tonight stay safe 
izwn_,ops just happened hang favourite black shirt laundry day  
cikeylx_,rakyat dah hilang kesabaran pemimpin makin bertambah zalim 
ammar_gaux,black tote bag pun jadilah 
pisboh,sekejap dah lebih 40k
aidielrosli,retweet semoga segalanya berpihak pada rakyat 
muhammadzakwans, ✨
ameliyeahzara,okay shift rambutan tree 
huzaylmohd,untuk masa depan negara yang lebih baik untuk generasi akan datang yang lebih terjamin kita solidariti rakyat 
_amalahsan,bendera hitam takde cuma ada baju mask dan gambar black and white boleh lah kan  
mhvminnn,gambar hitam pun boleh 
ebummie,solidarity with every ladies who sacrificed their tudung hitam for this movement 
mayna_patel,you cannot silence anymore want accountability and good governance has shown time after time that they able not able put the rakyat best interest over their personal needs therefore kita these are all recycled items 
marcellinos_28,’ sick your shit dear government deserve better 
halimshahminan,kibaran buah naga 
hachimsamsudim,baru lalu tadi 
nnjh1997, raise your flag 
salahudinmariah,hahahahahahahahahaha 
muqrizzzzz,dah punn nak siasat apa lagi 
ezrfdzlyn,baru betul semangat 
are_rane,dalam twitter lah 
h_bakkaniy,kalau muhyiddin tak nak letak jawatan biarlah mahiaddin letak jawatan  
syakismail,dari rumah kita kalau tak layan kita turun jalan 
halimlahh,terbukti erajaan muhyiddin paling fakop dalam dunia 
mydemuda,kita sampai tuntutan kita dilaksanakan letak jawatan parlimen dibuka sekarang taman darurat 
aidafatieha,adakah kerajaan akan bertukar kuasa hari ini ’ see  
ameerrhzat_,for birthday today wish nothing but see this incompetent and corrupt government step down and kau boleh pegi mampus lah sial 
witherthorne,are tired political games its longer buck move out just get the fuck out 
muhdacop19,⚫️
cipanjiwang,hoist the colors mates 
aizxtmot,hanya manusia tapi angan jadi tuhan asal dari lumpur tapi lagak macam api setan 
cuddyjah,undergoing quarantine room tapi lawan tetap lawan 
yatimisma,caused the backdoor government must fight 
zakiah84,malaysia perlukan perubahan tolong laa
unsophic,apabila usul ditolak tanpa ditimbang suara dibungkam kritik dilarang tanpa alasan dituduh subversif dan mengganggu keamanan maka hanya ada satu kata lawan wiji thukul 
aa_adib,tgh trending siot 
kewanganyuyu,just hanging laundry tho 
rezzarozi, lewat sikit sebab kerja tapi lawan tetap 
1ldk,waiting for perak 100years jersey utk muncul timeline sebagai bendera 
izan_janjira,tak ada hackers boleh hack pernah hack israel  
aaron_ariff,untuk diri untuk keluarga untuk negara  
longlegsvampira,something terribly wrong the pain sorrow and outrage people makes you more uncomfortable than murder itself  
ucu_asrie,hati kena putih baju mau hitam 
syedmuhdfaiz,never give  
dkamrl,una mattina sono alzato bella ciao bella ciao bella ciao ciao ciao una mattina sono alzato trovato invasor partigiano portami via bella ciao bella ciao bella ciao ciao ciao partigiano portami via che sento morir 
mydestinationmy,haha sian baju aku asal hitam  
_tedddd,style 
klimaaction,ribuan rakyat malaysia sudah jadi mangsa dan korban permainan politik sampah buka parlimen segera muhyiddin letak jawatan tamat darurat 
raikashoppe,had raise inside because have energy hang outside still suffering vaccine side effects but yes will still deserve better than this 
berbulumakhluk,rakyat tak perlu takut kepada kerajaan tapi kerajaan patut takut kepada rakyat 
luciferpepega,incredibly disheartening see the government incompetency even bordering idiocy with there constant changes with the lockdown more furious that costing the populaces living conditions even worst their lives 
fan_gogh,thanks well its like online protest country raise black flag show protest against our corrupt government you can check the hashtag know what happened since too many things had happened around here its kinda hard for tell you everything 
nektime_,masih lagi dikibarkan hari 
atoirahim,takde bendera hitam guna plastik sampah sebab kerajaan sampah 
ekax_,’ with this campaign 
fz_iskandar,berkangkung ketiak nak kibarkan 
d_liew,requests not much ask after all that you have asked since 18th march 2020 
yanameera,pinjam gambar 
irdinachos,the pandemic has truly highlighted the socioeconomic deprivation inequality that entrenched the govt but seeing how the rakyat rises against the system with let this reminder that power has always been the hands the people resign now
n1kee3,akhirnya aku faham apa fungsi koleksi baju hitam 
iztyl90,wear black when you buy groceries wear black when you get your vaccines mourn for the lives lost mourn for the fathers mothers uncles and aunties sons and daughters friends and colleagues who died  
thechekmad,happening now kibar 3pm 2021
imhaf88,letak dua2 nama sekali mahiadin dgn muhyidin dua2 org yang sama mangkuk bodoh tamak kuasa bongkak 
changtzeyoung,kalau kena saman tak tau sidai baju jer kot 
encikpena,hadir untuk bersama melawan kebodohan kerajaan bangsat 
badboy2662,toksah dilayan barua anjing umno kerajaan hari ini kita solidariti rakyat dan kibarkan ✊ ayuh malaysia kita ✊ 
mh9969,wife was equally afraid repercussions told her they only take the kids will still have her look after them 
mokciknab,when you want protest but nak jugak pakai cantik2 
juna9e_,tweeting and just keep trending
ephemeralegal,bukak parlimen cepat sikit lah takyah nak diam2 tunggu kerusi penuh 
mydestinationmy, july 2021 
minimeleis,and trending
khairilanuar,bendera hitam takde mat aku sidai tshirt ynwa dari klasiko kepada semua hari ini you’ never walk alone 
insy1rahxf,dark days are coming 
_snsyamimi,problem can use black tshirt 
ranazai91371471, top trending hashtags twitter the  world ️⃣ ️⃣ ️⃣ ️⃣ ️⃣ via 
fdaus_haron,03072021 
hamzahsudirman,bendera putih bantuan bendera hitam jangan salah kibar 
se_lancelot,for the only country ever called home for the country that didn consider one its sons for the ones that weren lucky 
sollehiensykes,another one for fallen brother also 
amarhafizi,ftg freedom that’ gone fck the gov 
kmurthychettiar,✊✔
nurfahazliani, cirit lah semua 
wanabdrahman,2016 nihh baru bro coldplay buat apa  
chrspepper,ambil baju hitam ambil batang kayu ambil gambar  
tiadaguru,sabah solidariti 
sinamikaaa,did this helped reduce the number cases 
fiqnaem,adik aku ahhahahaha yang penting 
catasstrofi,aku repurpose baju setherial lama aku jadi bendera hitam sic semper evello mortem tyrannis 
munqeez,ayuhlahhh marilahhh  
syafiqali7,bendera hitam dikibar pula sebagai ganti satu tanda ekspresi umpama satu interaksi meluahkan segala emosi apa yang dialami agar orang lain boleh fahami 
syahredzan,guys dekat instagram pun banyak posts check 
burningredberry,enough enough solidarity rise the black flag  
alyfrhnh,proud friends putting black flag 
lemmelemonade,seeing malaysians raising black flag for protestation made feel like learning sejarah 2040 sumn✋ but raise flag guys  
jurnalkolektif,rapatkan barisanmu kawan hancurkan segala penindasan 
nashuhahahaha,stay safe semua 
aownkhan18,alhmdolillah twitter trend worldwide 3rd num gov hosh   top trending hashtags twitter the  world ️⃣ ️⃣ ️⃣ ️⃣ ️⃣ via 
son_of_zaman,baju hitam layak gantung luar plastik sampah paling appropriate pun akan reuse balik 
jackberkicau,terus lawan sampai kita bertemu jalan  
mamaidle1,kibarkan tanda 
radianceleong, flag but can get creative vive révolution  
mcswennny,maaf takde bendera hitam 
bearontheloose,calling for the resignation the msia and reconvene parliament soon possible  
yasminadlyis,the sheer incompetency the current government calls for this urgently not ‘sometime’ before august the resignation prime minister muhyiddin mahiaddin the convening parliament the ending the emergency proclamation 
ahmedthaqif,gegar waknat gegar  
hadimnor,nampak macam sidai baju … 
afzansyazwan96,fuhhh panji panji hitam mula beraksi  
lialidia,demokrasi milik rakyat  
suenorazhar,see 
xeraheadstrong,kita bukan melawan kerajaan kita melawan ketidak cekapan kerajaan menguruskan negara suicidal rate meningkat kemiskinan dan pengangguran juga lockdown tiada kesudahan apa nasib kita sebagai rakyat kalau kita tidak menentang 
vanhuizen_john,• muhyiddin letak jawatan • buka parlimen segera • tamat darurat 
azizimusa_,’ sign from the universe 
tokperak8,kempen bendera hitam mahiaddin letak jawatan buka parlimen tamatkan darurat 
jieziie,let fight for mahiaddin letak jawatan buka parliment tamat darurat ✊ 
wawazwr,maaf repost untuk keselamatan kendiri kerana darurat yang useless jadi 
dhabitahzainal,even with bloodied fists fight 
paedrazip,just only have this black white striped comforter boleh kan hahahhhaha 
pelaripicisan,nasib baiklah pkp klau tak dah meriah dah dataran 
tharmapillai,baju penyapu pun boleh 
tanzrrr,besties 
ubaid_rac,tidoq dalam 
thisis_zharif,apron pedang jepun shinai pun jadi lah…  
khairulllllll11,doing little part step ass down 
lealterego,dah berapa hari konsisten kes bila nak turun tak nampak lagi kat mana masalah punca utamanya 
sweetnlowling, malaysia has lost more than 5300 lives thousands more are the brink starving struggling countless have died suicide hundreds have been locked the pretext immigration this unelected coup government needs gtfo 
kinatralalala,aku naik bendera hitam nie tadi dan masih kekal berkibar klu pdrm dtg minta cabut aku minta dia berikan aku akta apa melarang kibarkan bendera harini black flag saturday tenang kwn2 teruskan lawan turunkan tirani zalim ini 
yinling1111,konsep kerajaan sampah 
qifahss,aku dlm kereta nie jumpa songkok warna hitam black flag takde hmm apa apa pun tetap 
bukulima,time die kita 
bibobagginses,tudung hitam makeshift bendera 
univorso,“nobody the world nobody history has ever gotten their freedom appealing the moral sense the people who were oppressing them ” — assata shakur 
mohd_kns,welcome the black parade 
stpinkie,the afternoon the first day emco time kick back relax and check out this cool thing that twitterjaya has been talking about all day 
sinamikaaa,gonna every 
sukhriafiq,tulisan dari orang lapar moga tuhan hukum pemimpin zalim 
hakakmighah,let fight 
apanz_,bab rakyat buat kempen mencari solidariti laju pihak pdrm buka siasatan bab menteri dan vvip langgar sop kemain terhegeh hegeh nak buka kertas siasatan 
armandkugan,need better leaders need better captains 
naimazharrrr,jangan lupa iamwhoiam kita 
fareedrozaini, sebab politikus dan kaum kerabat yang sama benak sama bebal
wimbledam,need new progressive pragmatic and fit leader for malaysia calling the resignation mahiaddin yassin your time 
penatbuttercup,also think this goes without saying but just case jangan judge orang tak kibar bendera sebab munkinf ada yang parents standby dgn sudip dan sebagainya you see their dissent pun dah cukup our own ways 
ictweeets,have tried change the system and failed time break the system ’ rotten through and through 
xunlingau,the demands today campaign malaysia 
harizacap,aku dah ready dah tengah tunggu semboyan riot 
khairulaqmal,clubhouse 
x_msia,ubah malaysia politik kotor pemimpin korup malaysia dah penat 
abdmqdm,tak guna berdiam bila jom 
amirullahmohd_,kalau media tak buat liputan pasal memang sah lah kencing kebebasan media 
_suff,“ has start somewhere has start sometime what better place than here what better time than now ” 
xhmxdfxiri,hahaha kalau akak tengok ada ramai orang guna tshirt hitam plastik sampah etc
naifmansor,apa yang ada janji 
mohd_kns,change your into black welcome the black parade 
neddokhan,when you and your family members from all over malaysia are the same page  
terrydieheiden,fucking hate this government 
whoisaffiq,kerajaan jahat harus 
syahiraaa7,mak buyung join kita lawan  
chizbergerr,the people respresent the country not the corrupted people power 
ariffin____,buat bangsat yang bangga umum cirit birit dekat office resign bangsat tak pernah ada negara sebodoh kau babi  
fazleenah,real juga pakai shawl ada glitter yang penting 
afifahnrdn,black flag takde gantung baju hitam pun jadi 
statequote,this pandemic has demonstrated that malaysian pacifism has come cost the welfare and safety millions people cannot remain neutral apolitical when our lives have been made political  
hornyzennie,where the lie 
yatimisma,sampai tumpas 
don_gibap, you hear the people sing 
lanamadihah,allah hujan pulakkk basah kain hitam ini semua agenda kerajaan 
tiewwaykeng,tidak ada guna dan beg 
ariffasyraf1,salah 
peanutkacang,our demands resignation prime minister muhyiddin the convening parliament the ending the emergency proclamation raise your black flag together kita lawan  aci kan guna baju hitam untuk 
amirulashaffar,untuk masa kini dan masa depan anak2 aku 
nabilahdaud,july 3rd 00pm demands resignation prime minister muhyiddin the convening parliament the ending the emergency proclamation berat maknat buluh  
sreerajie,wind strong today resign now mahiadin reconvene parliament cancel the emergency 
hyeminie98,hear the anger from fellow malaysian  
zebigdragon,flyer detailing the demands malaysians who have been sick and tired their government 
hfzdnzm_,enough enough july 00pm this our demands resignation prime minister muhyiddin the convening parliament the ending the emergency proclamation raise your black flag together kita lawan 
fazeeratia,enough enough demand things turun parlimen bersidang hentikan darurat this the sign solidarity this the sign that had enough 
whoisaffiq,terus 
itszaf,  standing and solidarity with everyone that has been bruised beaten discriminated bullied and killed this shit government its time fight for our own rights that has been long disrespected 
psychedelicsash,the people deserve better have lost too many lives this virus and horrifying economic situation 
lamkanahraf,aku nampak  aku amplify kita protes alam maya bagi suara kami dengar tak kisah bendera hitam apa apa spender coli plastik baju semua kita guna janji  
asyraffaqrul,rakyat semakin lemas kerajaan masih lemau siapa muhyiddin aku tak undi dia  sampai 
zhrzainudin,lessgoooo  
ariefieee,part abg kucing bangun tido nak join bantah skali 
bumilangit,ini kalau kerajaan buka parlimen sehari sebab acah acah memang rakyat sumpah mati jadi babi … 
graxier, lawan
aaron16denison,bukan berkibar megah tetapi berkibar tanda marah 
iffycient,how much more burden can carry  
mira_ramiza76,daugther did tudung hitam mngsa 
rahman_rzk,“the only thing necessary for the triumph evil for good men nothing ” cliche quote know tapi tetap 
frzfauzi,black flag with cherry top 
nashbender,the closest thing got 
syedamiruledros,kalau jatuh baju bawah aku anggap jelah itu harga sebuah perjuangan empat sepit guna mat 
badboy2662, laa waknat ✊
shafiqxismail,selamat hari lahir hari rakyat  
sabah_bangkit,walaupun kita semua dah penat tetapi kita mesti tetap  
irenetheooi,black flag but wearing black shirt 
galaxyspeck, lawan tetap lawan
ndybry,kasi kibarrrr  
syazwanrazak_,macma jijik pakai baju kita pakai seluaq 
alsfarhan,acah sidai baju 
adrnmir,harini kita ayuhhhhh 
thatcutemaryam,tak ada bendera kita gantung baju hitam  
hafriziqbal,menanti hari keramat menentang pemerintah bangsat tiada yang dapat membunuh semangat membara dijiwa rakyat bangun sekalian umat bagai pahlawan melancar jihad biar dibasahi darah dan keringat yang zalim pasti dilaknat mati tirani mati 
rt19_,the shirt needs dry wear shirt because provides protection all the evil ‘bacteria’ around 
ezrfdzlyn,the only hope have left 
clipper27,out with this damned coup government get out 
ed4ili,look his profile picture black and white bro 
gradedheadgear,love our country but ashamed our government 
hamizanhmsn,wakil rakyat seharusnya merakyat jangan tidur  
erahsoo,gambar macam cover magazine  
ian_sodium23,kerja yang turut masuk dalam hashtag pulak 
popiagorengg,perjuangan rakyat untuk rakyat 
damiafa18410101,malaysia together  
kmurthychettiar,✔✊ 
youngumirah,had enough 
hvzxm,bendera hitam takde baju hitam dengan mask hitam ada  
patungpepatung,aku tak ada bendera hitam apa yang ada aku gunakan 
thezubair_m, tudung adik aku pun jadi 
zuyintoon,raising her ear flag 
official_faiz,baju hitam sebagai pengganti 
mohd_kns,tukar profile picture bgi hitam dlu kita bgi phenomenal skit 
azrulhardi,resignation prime minister muhyiddin the convening parliament the ending the emergency proclamation sampai 
themhmzh,takde bendera mat kepala plug ada 
fekryanuar_,dituduh subversif dan menggangu keamanan maka hanya ada satu kata lawan 
mymilkteh,you welcome day
v3n0mv7,janji 
lanamadihah,tak kisah lah buruk pun hahahaha 
athirahabd_,demonstrasi baling 1974 menunjukkan mahasiswa punya kuasa besar untuk menjadi pembela masyarakat justice delayed justice denied  
izzatyusofv,           
aralegatsu,black flags but lot black laundry hanging for better malaysia 
jjaetyong,couldn give big contribution but whatever kita kena for better malaysia love country and people but not the government repeat not the government that all don vote 
adamadli,thank you boh 
atikashburn,pakai kain tudung mak aku lantak lah 
anuaqqq,harini kita sudah penat kita sudah susah kita bangun bersama  
jim_ha_kho,lets all retweet blackflag 
benfaridazhar,yeahhh kita 
izdhrhkl,mahasiswa unikeris ada kelulusan nak guna 
rozalinakarim_,sidai baju for our future together kita  
algronjh,baju hitam pun jadi 
nurullfaseha,sikit lagi aku nak kibar spender hitam punyalah bebal kerajaan  
aleeyagffar,flags but wore all black jom lawan ready  
abdquddusmatisa,sampai jom 
navinerison_,each right here right now— are the resistance represent 
inizach,still does better job than 
apistoji,org bangi mmg gentle 
itsninott_,saya ada letak plastik hitam dekat depan rumah tadi kan 
wawazwr,hampir sebulan lebih kita ‘total lockdown’ tapi masih kes tak menurun 
soyuznara,guna bendera hitam sebab dah jadi yang berperangai macam terkena dasar dan betul sejenis kepada rakyat terbanyak
calmingrebels,washing all black shirt today 
yfis1,walaupun tak  tapi masih hitam 
ajiekysff,bendera tak ada yang ada cuma biskut hitam 
fiqnaem,kibaran kepada bangsat 
the_mamu,semoga laknat tuhan ditimpakan atas kerajaan celaka ini semoga mereka dilanda cirit susah cari parking dan selalu terkentut lepas ambil air sembahyang amin rabbal alamin 
amirashrafjalal,bendera hitam takde baju boleh tak simbolik 
tohka_aryani, you have support 
chairmanglc,rajin dia hijack hashtag 
rohadesu,how can you comfortable and well asleep when your people starving  
prashinee,only three demands resignation prime minister muhyiddin the convening parliament the ending the emergency proclamation  
jemybanban,takde” letak jawatan 
a4a35a,bendera hitam jpeg 
mohd_kns,change black 
izzzzamil, bukan untuk sahaja juga untuk wakil rakyat yang hanya pada nama wakil rakyat sahaja 
dominicmackee, sick and tired this incompetent murderous government 
xenomorpheus_,letss goooo 
muhd_imran23,selalu weekend sidai gym mat mgu unik skit 
mzhafranaslam,alhamdulillah aku ada baju hitam batang penyodok kat luar bilik untuk dijadikan lenjan jelaaa kita 
calvinyeoh43,hitam warna kemarahan rakyat kita 
mankimcat,muhyiddin hiding the toilet because still having diarrhea and trending 
khairulayams,pembangkang malaysia pun acah2 nak angkat bendera hitam bagai angkat bendera hitam bukti rakyat tolak kerajaan gagal tolak kerajaan belum tentu rakyat sokong pembangkang pembangkang dkt malaysia pun sama takde kualiti 
irfanmahzan,kibar bendera hitam hari sebab tak nak letak jawatan parlimen tak nak bukak tak nak tamat darurat sebab takut hilang jawatan 
labourmys,tahun 2009 
tiewwaykeng,guna 
wan_azmil,from pokemon community support 
ahmad_muziru,kalau hidup ingin merdeka tiada tercapai hanya berkata muka maju sekata maju kita melemparkan jauh jiwa hamba usman awang jiwa hamba 
