username,tweet
ligarakyatlrd,frontliners government servants got your back you you  
aidilrizal,this should played while kick all the politicians out our current shitty government 
hfzdotch,towards better nation 
emerhziq,support this using header 
mus_baekhy,style kite 
patricliew,this want believe implicitly man was born for love and revolution osamu dazai
fathisaif07,kita kibarkan mask hitam tanda melawan kucing rumah sebelah 
malsa_zej,made black flag made out paper anyways fuck them 
aisyahzulaimi,yassss  ini masanya untuk gunakan semua tudung hitam kita yang sampai helai orang kecam kata sama jenis tapi orang taktau lain material 
svxfz,beruk beruk celaka 
la_fareast, kerajaan sampah 
amiraashahrudin,only have demands resignation prime minister the convening parliament the ending emergency proclamation together fight for better days ✊ 
yiemdin,those tweets that people know that they aren alone this war 
arifarhanazlan,tired already  
dhiauddinsaad,langit seolah mengerti 
marrymejunh0e,shout out all malaysian kpop stans trend this hashtag this together raise the black flag  
kinatralalala,open room with all protest song 
pulotutui,102 
ashvinmenon,once you black 
saidinrose1,statement paling bodoh dunia 
laylamajusi,secepat mungkin kami akan terus 
carmwong,spotify play only the young taylor swift now the citizens are mad for long already and time speak the garbage has gotta 
fahmirad,credit 
ayaqjagung,aku tak gantung bendera hitam  tapi kalau terserempak dengan orang pakai ketayap logo pas aku nak ludah muka dia itu jaa 
lilwhinydot,for our children and the future generation 
miruldaniel,trending kalau tak letak jawatan jugak maksudnya suara rakyat takde makna demokrasi konon 
97abdulkadir_,jom bersama kita 
ibnzakuan,nampaknya hujan merahmati dan turut bersolidariti bersama 
propagandaoren,“the ultimate measure man not where stands moments comfort and convenience but where stands times challenge and controversy ” 
arifsetia2013rd,tak ada bendera hitam maka ini pun jadilah yang penting hitam 
45fortify,and are trending now this video pretty much sums all what the people are currently feeling 
aminmubarak_,mahasiswa uiam jangan takut untuk bersolidariti nyatakan kekesalan dan kemarahan anda pada pengurusan kerajaan ini bukan soal politik ini masa depan kita kongsi gambar gambar anda tanda solidariti  
sectionxsection,tuntutan kita dengan selagi tuntutan atas belum ditunaikan 
ezett_ruffeja,protes rakyat malaysia aman kibar pon pihak penguasa dah menggelupor nak sibuk kalau lah kita mampu protes atas jalan aku nak turun tau 
mengkudu_masam,aku semangat juga nak gantung mcm the only plain cloth ada adalah tudung bini aku bila blk bentaraguru lain mcm kesan psychology dia keatas diriku aku batal kan niat  kibar secara maya  tetap 
dhanrjdb,went all black top bottom today 
kakcharlottejay,into the scene katanya sesuai pulop langit mendung gitu 
furrarie,mak luvssss 
amiirulhaqiim,tetap kibarkan kalau ada masih bersabar lagi mungkin kalian tak kesiankan org lain terkesan majoriti ramai terkesan kita ada hak sebagai rakyat malaysian utk dpt selayaknya bukan 
badboy2662,langit pon turut protest ✊ 
frksgvrl,even hujan but still 
am_i_here_right,ramai yang kecewa dengan tindak tanduk kerajaan hari ini sosio ekonomi tidak lagi seperti dulu derita datang bertimpa2 ada juga sebaliknya mungkin mrk golongan privilege dgn adanya kerajaan ini status quo mereka terjamin gaji ada elaun ada kerja tak hilang 
badddmulti,nonkpop related moots gonna lot tweets under this hashtag you can mute for while ever feel annoyed 
rathikasheila,hahaha cute can’  happy day 
ariffadnann,plastik sampah pun takdehal khas utk kerajaan sampah 
johnlemonzz,ada orang tanya aku kibar bendera hitam buat dapat apa aku jawab 
aslamsome,mendung langit pun bersolidariti dengan rakyat malaysia 
_bangsam,kali kita 
hulubalang2017,because must take back what ours
eminarayanan,walaupun serupa langsuir aku ikat tudung kat tiang but don care  nasib baik ada tudung 
ecoliere,ini bukan  ini shawl hitam yang terpilih utk dijemur atas pagar hari shawl menang lucky draw laundry for today she gets the most sun pun dah gelap kejap angkat jemuran settle ‍♀️ 
keadilanbb,kenyataan media ranting bukit bendera berkenaan dengan siasatan jenayah terhadap timbalan speaker dewan rakyat merangkap ahli parlimen batu pahat 
hidayahoshin,“pasang impian cita ingin dicapai walaupun jalan jauh masih tak sampai anak muda perjuangan kita belum selesai”  terima kasih orkes hizadin untuk lagu ini  
sofeaghazali,molly said  
la_fareast,kerajaan sampah  
pugunaram1,standing for our nation  
faridzzubir,jose mourinho juga rupanya 
elliyanayusri,punyalah aku malu sedih dgn malaysia skrg sampai aku dengar lagu keranamu malaysia berulang ulang kali macam orang bodoh 
aiidielh,will retweet and like all the supports for 
hxfizuddin_,did predicted 
ropolsatan,you’ channeling your anger towards the wrong direction time fight each other hari ini hari solidarity 
cipanjiwang,same here being part history 
awillrosewater,dah lah harini mendung kena dengan 
iambadrulamin,cute 
harizakwan,mix and match black 
lemojlike,black flag available home but joining this with black attire selfie 
azharramli_,silap haribulan kau jadi buah catur chill kau kena cheat  
badddmulti,honestly tired all the the current gov had done 
jiwakencang,‍☠️‍☠️‍☠️
ilyaniehjhusin,yes using shawl without permission  
azraanuar_,gurl all those black satin shawls glistening under the sunlight look glorious  
sahrinmission,kau kental bro  apa 
nblhnrlzmii,allah selamatkan malaysia daripada pemimpin begini allah murahkanlah rezeki bagi mereka yang memerlukan  
ligarakyatlrd,pemimpin berkulit tebal semua kalau negara lain jika terjadi kegagalan begini ada yang buat permohonan maaf secara umum dan ada yang berhenti pemimpin kita angkuh 
azhari_azizi,jangan lupa mewakili juga tapi takpe kami jah suka jah pkp pkpd dasar kerajaan bagus buat apa dak2 medic final year iium belum dapat vaksin yela nak jadi doktor kena faham penyakit kan sebab pkpd depa belajar online mantap ir4 gituhh 
azhari_azizi,mungkin tak bersuara sebab mahasiswa iium kebal tak terkesan dengan dasar kerajaan alih2 pkp students suka sebenarnya seronok lah bacteria cultures berapa kali mati pkpd tadahal siapa nak masuk lab equipment bagai bosan lah baik duduk rumah 
asyisamess,jangan lagi kita tunduk dengan pemimpin zalim pemecah amanah penyalahguna kuasa 
orfullsun,gambar pinjam but let’ fight together fellow malaysians 
badboy2662,almost 90k lets get 100k guys  ✊ 
yessayaadib,muhyidin ialah bapak takdak telo 
fikriahmad__,disaat rakyat susah ekonomi tidak stabil tertekan dan merana tiada cara lain untuk kita bersama menyatakan kemarahan kita pada kerajaan gerakan ini dari rakyat dan kembali pada rakyat  
iambadrulamin,90k 
suhadaa_,awan juga seakan mengerti 
mfirdausgaffar,hati kau keras roy 
khairulllllll11,kene sedar bahawa ini protes maya coz riot will the finale least are this together 
pabanban,rakyat marah tak diperlu siasat puncanya satu saja iaitu kerana pkp sejak 18hb mar 2020 hari ini 3hb july 2021 masih kita dalam pkp gagal teruk kes masih naik walaupun darurat dilaksanakan jelas darurat bukan untuk bendung covid 
2337idzham,fuck kerajaan fuck israel fuck flat earth 
farraolivia,jemu 
maqrihalim,not trend ’ demand 
gausslagenda,negara lain dah boleh tengok live euro kita masih dalam emco  
barbadensisbabe,may you experience divine favour and support your endeavours may everything you touch and create blessed and blossomed into something that impacts the world may the blessing that’ you continue drip into every area your life aamin happy birthday twinzy 
dinguswoes,ada polis round rumah tadi mom biar dia lalu apa dia boleh buat nak saman pon akta mana dia nak saman ingat orang bodoh tak tahu law love mom  
boynaqeeb,not just wearing black protesting  
zakuanhamdi,gila2 bila baca dalam thread ada cakap tutup dari tangga kecemasan punya lama kaji kaji macam hasilnya kalau tempat terbakaq minit target untuk kosongkan premis hang kaji dak sebelum buat keputusan 
safsetan,when you dont have black flag but you have black kain and rake its the thought that counts  
syaznotsyaza,this government another level ujian daripada tuhannnn 
sitiwanee_,mocha ready  
imaaaaaaaaannn,gaiss 
effanordin_,syair perang nakal raw version via 
iamjoelee,nakama 
ligarakyatlrd,may the force with 
doubleja,said what said 
ictweeets,freedom’ just another word for nothing left lose 
hilalazmi,harini umum tak boleh makan nasi… esok peraturannya kena makan sayoq saja… lusa semua kena makan cucoq… padahal orang lapaq nasik dok bagi peraturan2 yang overule peraturan lain pastu satu dunia konpius camna hang nak 
fathuuuaishan,jogging satgi aku nak pakai full black dari topi sampai kasut haaa 
asyisamess,kalau kita kita lawan sampai kita rakyat menang
mohdikramghafar,depan gantung belakang pun gantung 
scbarai,komunikasi yang baik tidak akan menghasilkan kontraduksi serius arah turut mudah melawan pula adalah hasil dari komunikasi tidak baik arah turut yang lebih kepada dipijak jerut yang memaksa untuk bangun jadi bangunlah  
inuyafnitaf,cuz baju hitam are too mainstream kita kibar kucing hitam 
amarhmf,for the nation for our future for our legacy 
riseofkentucky,make this get more than 100k
syahredzan,boleh cecah 100k 
mummifiedlilac,can afford buy black flag but can show that incredibly disappointed tge kerajaan social platforms 
khadeejaencik,yeahhhhhhh  
kajimsharibi,hadir 
atomicuuuu,with these all over the timeline one particular song comes mind you hear the people sing 
nakhoda_ragam19,road 100k malaysians kita boleh lakukannya  
ammaraffandi96,kalau retweet dah sampai 80k semua turun jalan dah boleh settle masalah sial 
shkrshdn1,got soul but not soldier  those that sick enough with the government nowadays stand for the lower marhaen voices you got respect rise  credit goes poster owners  
mhaikalmf,kibarkan bendera hitam anda let them know who’ really charge here  
hxkxmxhmxd,langsir bilik aku memang dari awal tahun dah bertema lawan kerajaan lawan bantuan pls lawan  
syeraadzmi,dia macam tiber tetap 
partneriqbal,kita buka parlimen buka semula ekonomi negara 
mash_who,can wait nak tengok buku sejarah anak anak nnti pasal and when dorang tanya kenapa jadi macam bolehlah cerita apa yang kerajaan buat pada rakyat 
shutthefkup13,other sister 
hazrieayup,lup chew ☹ saya anggap ini sbgi simbolik kpd perpaduan kita dlm sekaligus menyedarkan kita bahawa perpaduan adalah kunci bagi menentang kezaliman karya beliau kalau dihayati dgn sepenuhnya insya allah dapat menjadi pemangkin kpd perpaduan rakyat fatihah 
sarfabian,counting 100k now 88k 51pm 
fadilahwirae,nak nangis pulak government sucks 
azharramli_,tak mampu buat semua jangan tinggalkan semua 
apalu_mau, resign and step down with your other illegitimate cabinets for your incompetence 
cyraaeiou_,the worst government ever dulu tahu kibar bendera jalur gemilang now have fly the black flag because the incompetent leaders are suffering are angry are going fight until the end 
mdmaman_,demi rakyat kita bangkit 
ahmadyusriyusof,bendera hitam takda mask hitam pun boleh 
badidea98,malaysians can very optimistic and patient but ’ sick and tired 
loldannyhere,use your platform spread the word 
hulkfeez,jubah hitam pun jadi lah 
abdyumm,rakyat meminta hak mereka dianggap penjenayah rakyat dikutuk dan diserang saudara masa rakyat bangkit lawan mereka  
baikragu,black coffee 
nimilan6,good job 
aymanpsycho,dalam kita bangkit melawan rejim yang zalim jangan lupa perjuangan pembebasan akan kekal gagal selagi kita mengangkat golongan bangsawan elitis dan borjuasi sebagai wakil suara rakyat selagi kita menjulang demokrasi borjuasi selagi itu kita akan terus dibangsatkan  
dumplingdena,sedang pakai tudung hitam walaupun tidak mengibar 
syahredzan,sebab aku akan dan qrt 
domesticgod8,just want say minorities msia been living thru systematic racism oppression the last 60yrs what don’ kill makes stronger 
danialasyrafs,hari aku membuat keputusan beraktivisme untuk aku sedar ada setengah pihak yang tak gemar dengan perbuatan aku ini sejak aku sekolah menengah lagi namun demikian aku tetap akan  
mandeepkarpall, bukan sekadar warna  adalah simbol kita semua bersama dalam rakyat bersolidariti bersama rakyat untuk melawan kerajaan gagal ini kita bersama selamatkan 
normiswary,sedang tunggu parlimen buka kemudian kita  
novinthen,need more 
idayumumtaz,while waiting for response from any please feel free reply this tweet with your photo support the rakyat movement you are iium student off campus semoga mahasiswa kita terus bersama masyarakat ❤️
dinnnnyminimore,got this from friend 
weieyka,bantu mak buyung meniaga gaiss masukkkk shopee live santai clearkan preloved  size banyak sahaja from rm2 rm10  watch shyrasahar44 live now 
helosabby,kain selimut tebaq luaih luaih 
theshadowww_, tuntutan kami perdana menteri mahiaddin letak jawatan parlimen bersidang tamatkan perisytiharan darurat 
aameenzuber,resign  
itsafiqafandi,ayuh kita sampai dia meninggal 
alia_syaqeera,kalau dlu mmg tknk langsung masuk politik kalini kita 
nakhoda_ragam19,saya guna kain pelikat gajah duduk 
izzadooo,kita bro 
danielhzre,yeah would for now rest peace and ’ stand with you  
nimilan6,function influencer macam yang kita mahukan mantap 
ninaal1ah,our thoughts feelings are valid this out harm’ way manifest our frustration towards them one ask you guling street damaged done pun you think this useless stfu most importantly the pressure the gov are now circulating 
arifeddy12,standing outside the house because don’ have any black flag 
nisaaidilakbar,the demands resignation prime minister muhyiddin the convening parliament the ending the emergency proclamation  
daryideanna,kalau kau rasa bising bagus memang itulah tujuannya 
cikgurahayu,bangga dengan revolusi tudung hitam hari 
amrhzzty,pass angry dekat korang dah tak larat nak marah 
amaan5,shouldn this way 
harumonia_,rindu nak buat gig rindu nak tengok gig rindu kawan2 yang pergi gig 
shyaam28384236,jom 
tajlazre,takde bendera hitam baju hitam gambar hitam putih ada lah  
nomannurs,the only thing could put infront our kedai tuntutan mahiaddin letak jawatan parlimen dibuka segera tamat darurat 
tiadaguru,another iteration prepared one 
darkzagaming,kempen dan bendera hitam dah dijalankan siapa harapan korang untuk ganti tempat yang sekarang 
ybtokmet,bendera hitam simbol kemarahan rakyat kepada kerajaan teruskan bersolidariti terima kasih rakyat kalau ada yang memerlukan bantuan sekitar anak bukit dan kubang pasu saya ️ 
naimnazir,aku kau kita malaysia sedang sakit dan tenat kita semua lawan 
blacktar_,wearing all black today cuz hate the gov 
anissanosan,hujan ”shawl” sidai bawah bumbung 
cik_kk,expectation reality nya menang trending tetap kelantan hahahahaha adeh 
vin_der_pal,the end the day all have one common enemy oppression 
growingupgrumpy, for riri  for country 
ainawafiabkadir,tuhanku wajahmu membayang kota terbakar firmanmu terguris atas ribuan kuburan dangkal anak menangis kehilangan bapa tanah sepi kehilangan lelakinya bukannya benih disebar bumi subur ini tapi bangkai dan wajah mati sia sia rendra 
suhara862,⬅️ 
imrannordin,bersama 
injangnation,semoga dimurahkan rezeki dan diberi perlindungan serta keselamatan ketika mencari rezeki 
akuguard,yang penting kita 
vinodveloo,even mother nature with today 
forabettermy,when the populist believes that better than really have wonder what goes the brains malaysians 
acaprahman92,lawan selagi ada maruah diri 
syahmi26,remember when was young boy wanted the saviour the broken the beaten and the damned 
thearamhd,all black ingat tadi 
gloriaisdeadd,muhyiddin yassin mahiaddin yasin letak jawatan  
nicknameesther,glad didn show the face this person muhyiddin will never resign needs ousted parliment arrested the police sacked the king definitely has done enough damage the people country hope the king sees all the black flags sacks him 
hafidz_12,bukak twitter rasa marah rasa marah bukak twitter 
tvya_97,sumpah kalau ada rally macam bersih pecah rekod bilangan orang kumpul mampui kleptokrat kleptokrat semua kalau rakyat semua gabung tangan entah apa nasib diorang 
kiranraj2305,yesssssss btw support our msian initiative against msian government uncle 
shafwanshukor,bapak ikat drip dekat conduit electric aku tahu yang cat oren adalah penebat yang baik tapi still bahaya kalau ada leakage abende yang gomen pikir sekarang rakyat tengah nazak sistem kesihatan dah lumpuh 
najmiluthz,sebab takde bendera kita guna emoji 
danishfirhan04,better pic  
goodluckaydam,alang alang hujan jom doakan negara kita arah lebih baik 
mudaxpetaling,adalah kerajaan yang gagal mentadbir membantu dan mengeluarkan negara dari kemelut belum pernah timeline penuh dengan kemarahan rakyat dengan kerajaan seperti ini kalau bukan disebabkan pkp rakyat dah jalanan
haostheticc,you are bitter about bendera hitam because you are fated born malaysia you should then dictate god determine where you want born and die mentality very low intellect also very low sibuk nak jaga hal bendera hitam 
yonlikethem,hari hari esok adalah milik kita 
fakhrilzaidi,pkp beratus ratus hari kes tetap mencanak tinggi ada pula pak menteri yang hari hari tunjuk bodoh tak bertepi maka kita sampai ✊ 
hazeeq12345,opss lupaa 
khalifazman,letak jawatan letak jawatan letak jawatan letak jawatan letak jawatan 
diannnatasha,for ot4   
ineffableiris,july 3rd 00pm demands resignation prime minister mahiaddin the convening parliament the ending the emergency proclamation 
wanmhdamir_,fed dengan pemerintahan macam 
sameerkhanlgk,has tweets 
shazacaje,putrajaya bahaya kalau aku tiba2 gantung bendera hitam kang tak pasal2 kena angkut sbb tempat kerajaan 
khalifazman,letak jawatan 
thinnythins,today’ historic day they’ better include this sekolah menengah sejarah books when ’ time update the syllabus more painting pretty pictures the government more cover ups 
redrun_,bendera hitam takdak batang mop basah sangkut baju hitam jadi lah bangsa kita bangsa melawan  
afndy73,kerajaan berhutang berbillion tapi pembangunan apa pun tak nmpk nak kata utk tangani covid keadaan semakin teruk hospital2x elaun penjawat awam dipotong gaji pekerja pembersihan pun kena potong smp bawah giler gaji minimum apa kejadah 
aaron16denison,turut bersolidariti dengan kita adalah rider yang sedang mencari rezeki jaga diri dan terus 
yepbooba,hamzah zainuddin anak babi 
haiqalafiq__,saman dulu timbalan speaker yang berkumpul makan durian tuh baru boleh sembang sial punya kerajaan dengan bendera pun takut 
melgohcna,from white flag black flag after campaign heats malaysia among netizens calling for resignation muhyiddin lifting emergency rule and parliament convene asap also trending more than 000 mentions within hours 
acapazizan,terus kan bang tetap 
adimxns,dengn jiwa sampai tumbang 
dinguswoes,you are scared make changes and scare overthrown the injustice and incompetence those who charge then you have chosen the side oppressors 
aryyaff,hari hari asyik nak marah bila tengok perangai kerajaan and ada sesetengah pihak hilang sabar kalau hari hari macam  
sahrinmission,kasi kibar  
theshadowww_,teruskan hashtag biar mereka tau rakyat dah hilang sabar mereka sdg takut teruskan 
luv_shaa,kucing pun mka garang ready nak 
tijnarinif,country deserves better the rakyat deserves better fight for what deserve 
yepbooba,bukak parlimen jangan jadi bacul kerajaan poen 
e_a_ismyname,solitary with keep your spirits high and keep fighting for the future this country  
annoooyinx,pakai hitam kire tacing ngan boifren 
cheeseundrcover,kita sampai pekak dengar 
mohd_kns,rip politik malaysia 
mohdazmen,isteri tiba tiba buatkan 
mardiahjane,bukan woke tapi penat 
izzat_xilli,️‍ 
redditmalaysia,black flag designed for the black flag protest inspired hong kong protest flags 
chinepaiyenoffl,see all the ppl who stay quiet times when ppl use their platform speak against injustice death suffering our country referring peers the content creators influencers entertainment space when injustice becomes law resistance become duty 
ammrasyraaf,well ive always wear black anyway stop discriminating locals and foreigners for political purpose 
lordstomper,salam perlawanam  sehat selalu sodaraku 
sofeahjoned,ini bukan palestin ini malaysia yaa tanah air kita  
lumieredieu,tak bendera kertas hitam pun jadi lah 
hayierul,lawan tetap 
bellanattty,all the best malaysians ’ get thru this you won’ ruin malaysia any longer you have failed fear the people 
mhdafq,lupa nak snap outfit all black aku tadi boleh ikut trend semasa 
anxpz_,aku harap subjek sejarah akan datang letak topik bendera putih dengan bendera hitam biar dorang tau macam mana kehidupan sekarang biar dorang tau macam mana pemikiran ahli politik time sekarang 
nazhanakid,tudung hitam akak aku but still 
nicknameesther,good replacement for black flag cheap anyone suffering under this government can put one too 
ketua_darjat,nah kau 
sufiazfar99,apa beza kerajaan dengan saya saya ada telur kerajaan takde 
machaling_,takde bendera hitam tak mampu beli tangan pun hitam apa lagi  
sundalmcwhore, bangkit  tentang  lawan  bangkitlah kaum tertindas tidak akan kita hilang satu apapun kecuali rantai besi yang membelenggu 
miggychino,all these words they not listen they they please with accountability repercussion fight back against this imbecilic hapless government  
nazanto,guna apa yang ada hatta ianya tripod sekalipun 
alinaise,karya ini pula dituju kepada semua warga annette lemieux black mass 1991 
propagandaoren,“the penalty that good men pay for not being interested politics governed men worse than themselves ” 
joshychong,terjemahan fikiran berliku pagi 
ccourtneycobain,terlalu banyak permainan tetapi bukan rakyat yang harus dipermainkan 
lagacawan,kalau ada beritahu kita pasang kat kereta motor sampai muhyiddin letak jawatan 
tharunpillai,demi malaysia 
hepibird,sila letak jawatan jika kau bermaruah sebagai seorang “pemimpin” rakyat dah benci dengan kau btw mana haziq 
me_siam,need your support just the other side the globe 
adinangah,jangan nak jaga periuk nasi sendiri 
xpectopatronum_,while you guys roam freely rakyats suffer shame you malaysian government 
deanjamal785,for malaysia 
sayapramarama,shawl pun shawl laa 
furrarie,flag might pathetic but the state country  
baihaqi1989,kredit gambar 
sharkawiahmad,elok gambar kempen pun 
kashiffulsharif,jangan tak lawan 
demokrat_my,sudah semestinya 
k1m1eee,tudung bawal mak aku jadi mangsa nasib dia bagi izin hshshs 
izzatdalphia,wearing ⬛️ solidarity with 
mair_umai,kalau kibar dekat rumah kena saman kita kibar dekat display name  
kkrish_kumar22,much love and power from  everyone that fighting the back home  
belialrising,revolusi berlaku dari jalan raya kempen kibar bendera hitam hanya perang saikoloji saja peralihan kuasa takan berlaku setakat kibar bendera hitam kena turun jalan raya dan 
afiezatulakhma,this fight for those who are longer with for those who are helpless for those who are depressed when incompetence becomes the law resistance becomes duty  
___ndrea,today seems like great day watch for vendetta 
forsyo,kedah kena sampai dia terduduk 
izzathazlimi_,“’ not pleasure this kind shit served the government”  
izzaatfauuzan,rembat kakak punya tudung 
adh4mafiq_,one more time are not scared  
khairulhafiz_97,minta maaf aku ckp aku amat mrh dgn kerajaan skarang tidak pandai urus tadbir negara pentingkan diri sendiri serta berat sebelah now this time 
jestinrajs,maaf tak dapat kibar bendera hitam sebab sibuk sikit menyampaikan sumbangan pada 00ptg tadi baju hitam pun bolehlah sebagai tanda sokongan 
aaron16denison,inilah semangat rakyat malaysia 
sapetesedih,bak mai 
saidinrose1,terus masuk firdaus 
mohd_kns,gantung shja xckup kne tukar skali kasik kecoh satu malaysia jgn sekian propa murah dari saya
zafirahzukipli,saya dan kibar 
niearuz,kita guna ballon hitam jelah 
nuhilistic,️
ernestmhs,absolutely excuses for the egregious mishandling covid malaysia are tired today demand the resignation muhyiddin yassin the reconvening the parliament the ending the emergency order 
jariski,kebetulan telekung tengah jemur   
amirulhakim08,hoist the colors 
thechekmad,accurate symbolism ✊ 
kellyjunghye,what are they gonna arrest the rakyat malaysia you think people will shut they try silence the rakyat after this 
muzamminmuzlan,sila letak jawatan 
syikinharrose99,cantiknya paper bag mellow crunch dah kali repeat   
solehuddeenn,hari masuk shift malam outfit blacked out kalau polis tanya dkt aku jawab 
faruqmcgrath,gue kempen sejak minggu lepas sebenarnya benci takyah cakap memang dah lama 
ciksitihani,family and friends been through lot during this pandemics don care anymore the better malaysia 
hfzirwn19, even langit pun gelap 
mash_who, student2 ipt jangan lupa fight for right  
izan_janjira,malaysia sekarang sad but true 
hepibird,ramai malaysia belakang dsai ayuh kita tendang keluar pengkhianat negara ini dari pemerintahan negara 
1mannnn,tuntutan muhyiddin letak jawatan parlimen dibuka segera tamat darurat 
lahnapi,kalau nak mencari menteri pertama elok kedua pandai mohd daud 
papaqqs,kalau ada kebakaran mcmana 
imaaanginasi,bersama kopi pak ajis 
iamwildflower_x,“kebenaran sedang dipenjarakan penjahat berkeliaran dan sembunyi balik ketek kekuasaan” 
chezahidguevara,sebenarnya suka turun jalan jumpa kawan kawan dalam bab tapi tak boleh dalam situasi sekarang apa apa cara nak tunjuk lawan sekarang kita sokong jadi kita kibar 
bev_tj,jangan takut terus bersuara ✊ 
_akim94,nak start dari awal balik 
rhealoveskeyaki,way too tired anything all but enough enough 
ashikinfazi,boooooo takyah siasat 
thaqeefsidek,light  
redhxkhxlis,aku sokong ayat 
zayne_rodz,rising the colour  
zikrulsafwan_16,kalau tidak kerana pandemik rakyat sudah turun jalanan 
